{"schema_version":1,"mode":"demo","generated_utc":"2026-10-19T12:00:00Z","as_of_utc":"2026-10-19T12:00:00Z","source":"demo-generator","quotes":[{"symbol":"XAUUSD","bid":4038.1,"ask":4038.34,"mid":4038.22,"spread_pips":24.48,"change_pct":0.335,"day_high":4054.13,"day_low":4011.24,"atr_pips":845.8,"atr_pct":0.209,"volatility_state":"NORMAL","spread_state":"OK","last_tick_utc":"2026-10-19T11:59:59Z","spark":[4019.29,4019.81,4021.98,4022.77,4023.18,4020.7,4021.41,4016.98,4013.59,4016.92,4021.04,4027.23,4033.5,4032.45,4023.82,4024.76,4026.39,4028.4,4029.64,4035.15,4035.76,4039.33,4041.39,4040.88,4044.41,4045.55,4046.29,4051.28,4050.7,4048.08,4046.88,4046.93,4044.36,4044.42,4047.52,4048.44,4050.52,4049.07,4045.67,4045.62,4042.55,4040.82,4042.99,4040.63,4039.2,4039.76,4040.1,4040.88,4037.73,4037.76,4038.41,4038.22,4035.58,4034.12,4035.84,4037.69,4038.82,4038.7,4038.29,4038.22]},{"symbol":"EURUSD","bid":1.12612,"ask":1.1262,"mid":1.12616,"spread_pips":0.71,"change_pct":-0.097,"day_high":1.12878,"day_low":1.12589,"atr_pips":6.5,"atr_pct":0.058,"volatility_state":"NORMAL","spread_state":"OK","last_tick_utc":"2026-10-19T11:59:59Z","spark":[1.12759,1.1278,1.12818,1.12853,1.12849,1.12858,1.1285,1.12848,1.12815,1.12806,1.128,1.12789,1.12836,1.12816,1.12806,1.12815,1.12831,1.12827,1.12823,1.12829,1.12835,1.12835,1.12808,1.12804,1.12815,1.12829,1.12811,1.12837,1.12825,1.12793,1.12755,1.12765,1.12754,1.12743,1.12724,1.12729,1.12722,1.1272,1.12728,1.12721,1.12751,1.12795,1.12804,1.12774,1.12773,1.12757,1.12767,1.12707,1.12711,1.12635,1.12635,1.12614,1.12613,1.12636,1.12667,1.12653,1.12661,1.12615,1.12638,1.12616]},{"symbol":"GBPUSD","bid":1.2997,"ask":1.2998,"mid":1.29975,"spread_pips":0.95,"change_pct":0.648,"day_high":1.30356,"day_low":1.28988,"atr_pips":8.6,"atr_pct":0.066,"volatility_state":"NORMAL","spread_state":"OK","last_tick_utc":"2026-10-19T11:59:59Z","spark":[1.29307,1.29367,1.29396,1.29363,1.29435,1.29499,1.29549,1.29599,1.29639,1.29775,1.29817,1.29811,1.29824,1.29851,1.29901,1.29946,1.29991,1.29974,1.30103,1.30167,1.30176,1.30169,1.3015,1.30184,1.30192,1.30171,1.30172,1.30213,1.30243,1.3024,1.30244,1.30245,1.30231,1.30272,1.30327,1.30312,1.30316,1.30289,1.30248,1.30217,1.30153,1.30113,1.30112,1.30117,1.3008,1.30105,1.30085,1.30101,1.30076,1.30069,1.30081,1.30059,1.30067,1.30052,1.3004,1.30023,1.30013,1.29978,1.29989,1.29975]},{"symbol":"GBPJPY","bid":193.653,"ask":193.667,"mid":193.66,"spread_pips":1.46,"change_pct":0.846,"day_high":193.946,"day_low":191.891,"atr_pips":17.8,"atr_pct":0.092,"volatility_state":"NORMAL","spread_state":"OK","last_tick_utc":"2026-10-19T11:59:59Z","spark":[192.89,192.932,192.96,192.864,192.872,192.818,192.915,192.925,192.901,192.854,192.861,192.848,192.766,192.729,192.75,192.794,192.989,192.88,193.035,193.138,193.21,193.089,193.154,193.076,193.155,193.304,193.319,193.365,193.372,193.489,193.541,193.575,193.654,193.584,193.607,193.654,193.676,193.734,193.757,193.747,193.788,193.811,193.779,193.791,193.926,193.866,193.885,193.873,193.854,193.759,193.835,193.793,193.77,193.798,193.628,193.603,193.696,193.646,193.669,193.66]}]}
